StartDate,EndDate,Status,IPAddress,Progress,Duration (in seconds),Finished,RecordedDate,ResponseId,RecipientLastName,RecipientFirstName,RecipientEmail,ExternalReference,LocationLatitude,LocationLongitude,DistributionChannel,UserLanguage,QID15,Q16,Q17,Q18,Q19,Q1A,Q2A,Q3A,Q4A,Q5A,Q6A,Q7A,Q8A,N0,N1,N2,N3,N4,N5,N6,N7,Narrative Reflection,Q1B,Q2B,Q3B,Q4B,Q5B,Q6B,Q7B,Q8B
Start Date,End Date,Response Type,IP Address,Progress,Duration (in seconds),Finished,Recorded Date,Response ID,Recipient Last Name,Recipient First Name,Recipient Email,External Data Reference,Location Latitude,Location Longitude,Distribution Channel,User Language,What is your level of education?,What is your age group?,Which of the racial designations below best describe you?,What is your gender identity?,"What religion do you associate with, if any?",I would not mind if a qualified Jew were my boss.,I would marry - or support one of my children marrying - a Jew.,Jews and the average person are different in the values they teach their children.,Most politicians care too much about Jews and not enough about the average person.,The actions taken by Israel in response to October 7th are justifiable.,Humanitarian aid should be increased to the civilian populations affected by this conflict.,Israel is engaging in action that could be classified as genocide against Palestinians.,The United States should maintain its military support for Israel.,"Please read the following social media post:

Preface: I am Jewish. I would not say I support Israel, but I do favor a two state solution. Sort of a ""Why can't we all just get along?""


What is it that seems to have everyone so anti-Israel right now? I know there's always war in the middle east, but tensions have risen a ton as of late. Hamas attacked Israel in October, and I know that Israel is fighting back, often in less than ethical ways. But aren't Hamas and Palestine also committing crimes and being violent against Israelis? Why has the general attitude turned so anti-Israel in what's going on?

The people who answer questions here are awesome","Please read the following social media post:

https://twitter.com/i/status/1782826724813656361

How is any of this free mixing, dancing, playing the annoying dammi falastini song helping the people in Palestine? These ""protests"" are just a cesspool for killing time and a break from their monotonous lives. And they think they'll get Allah's help by doing so. What a bunch of libtards.","Please read the following social media post:

It's crazy to me that israel went to be known as this tourist hub known for beaches and clubs and this reputation for human rights and democracy. A destination for many and example for all especially to the middle-east to basically a laughing stock and being revealed as a morally bankrupt state.

First let's start with the IDF losing any source of credibility. Many people love making fun of hamas ministry of health numbers saying how little trust they have in them. Well guess what to the majority of people the IDF numbers and reputation matches Hamas.

Just looks at all these IDF examples.

IDF killing IDF soldiers:
https://www.nbcnews.com/news/world/nearly-15-israeli-soldiers-killed-gaza-died-due-friendly-fire-accident-rcna129285

IDF killing israel hostages:
https://www.timesofisrael.com/idf-troops-mistakenly-open-fire-and-kill-3-hostages-in-northern-gaza-battlefield/

IDF killing peace envoys:
https://www.npr.org/2024/04/01/1242177519/world-central-kitchen-workers-deaths-gaza

IDF killing palestian icivilians
https://www.theguardian.com/world/2024/apr/02/gaza-palestinian-children-killed-idf-israel-war

IDF killing israel civilians:
https://www.reuters.com/world/middle-east/israeli-military-opens-probe-into-reports-oct-7-friendly-fire-deaths-2024-02-06/

IDF soldiers acting as kids:
https://www.pbs.org/newshour/world/videos-of-israeli-soldiers-acting-maliciously-emerge-amid-international-outcry-against-tactics-in-gaza

IDF supporting a man made famine:
https://www.washingtonpost.com/world/2024/02/10/gaza-aid-blockade-protest-kerem-shalom/

I mean the examples goes on and on. It's a shame this sub-redditt doesn't allow videos because the videos I can post about the IDF army and their behavior are countless for any one video you could post , i can provide five its insane. At one point the IDF had this reputation of being a supreme military force that was an envy to other world military forces. Guess what that's down the drain. The IDF record at fighting in the ground against hamas has been terrible, they basically only have an advantage when it comes to dropping bombs from an airplane to a force that has no air power. Their fighting a military force that is using Soviet era machine guns while they have 21st century armory and have a poor record. Can't tell you how many military podcasts make fun of the ineptitude of the IDF on the ground.

https://foreignpolicy.com/2023/10/26/israel-hamas-gaza-military-idf-technology-surveillance-fence-strategy-ground-war/

And what a hungry for blood mentality by israel , I don't see many people on this sub-reddit talk about the embassy bombing in syria. But its hard to even find a modern example of another country attacking an embassy. Under the 1961 Vienna convention on diplomatic immunity, the premises of a diplomatic mission are inviolable. I mean you can just feel the Telegram of israel wanting iran to retaliate to justify a Lebanese invasion or spreading the war to Iran. If I was a citizen I would be outraged my country is trying to expand the war. But guess what netanyahu is trying his hardest to stay in power and you smucks are happy letting him play a political game while we're seeing one of the worst modern massacres of our life time. Yes let's tie a war with a politician that's trying to remain in power so he won't go to jail for corruption, I don't see anything wrong with that

Every single international body, almost every citizen in all countries have been shocked and distrusted by the actions of the IDF and the israel government. The amount of tourists that will go to israel will decrease the amount of citizens leaving the country is also increasing. Honestly seeing a country going from 100 to 0 is quite amazing but somehow israel is doing it. You have support of the U.S government, the president of the united states calls himself a proud zionest and many still pretend that nobody supports israel and you are all being malignant attacked for your religion when infact your actions is what anybody needs to judge you fairly.

Many comments are going to reply what do you expect a country to do post oct 7, well it's definitely not what been happening for these past 5 month, hopefully countries have a playbook on what not to do by not following this inept country and it's military.","Please read the following social media post:

I was looking at the number of Palestinians terrorists released for each hostage both in the past and in the current situation and the ratio is insane.

As someone who fully supports Israel why does this happen ?

Is there really so much leverage on their side that for each hostage so many terrorists need to be released ?

If anything, multiple hostages should be released for each terrorist !","Please read the following social media post:

I said what I said. I can’t fathom why people could so strongly support either the state of Israel or a Hamas-led Palestinian state. Both have been committing unspeakable acts against each other. Going back in history, sure, Israel’s offensive has led to more Palestinian deaths than vice versa. That is the outcome of having U.N. aide and support. Is it wrong to say that if you choose Israel or Palestine, you are just blindly supporting your own racist ideologies? I feel as if people are choosing white vs. brown when it is so much more complex than that. Should I, as a Christian, be under the belief that we should take Jerusalem back for ourselves? No. But we have just as much claim over that Holy land that Jews or Muslims would? So why are we acting like Palestine is in the right, or that Israel is in the right? Being pro-Israel does not call for a ceasefire. It calls for brutal retaliation that no good human or practicing Christian or Jew should support this or the things they have doen in the past to oppress Palestinians. Being pro-Palestine does not call for a ceasefire, it further creates tension and the divide only grows stronger. No Christian or Muslim should support the things they have done. You are not advocating for peace if you are only advocating for donating and helping one side. Just my two cents, as a local white boy! Not sure if my race matters, but race seems to be all that matters to a lot of pro-Israel or pro-Palestine supporters! I am not spewing pro-Zionist bullshit here. Calling for peace is not pro-Israel. And it’s not pro-Palestine. It’s being a good human with proper morals. The divide is so strong already in the Middle East, it shouldn’t extend to the States and the UK, we should all be denouncing both.","Please read the following social media post:

Company: Natera Location: Afghanistan Albania Algeria Andorra Angola Antarctica Armenia Austria Azerbaijan Bahrain Belarus Belgium Benin Bosnia and Herzegovina Botswana Bouvet Island Bulgaria Burkina Faso Burundi Cabo Verde Cameroon Central African Republic Chad Comoros Congo Congo, The Democratic Republic of the Cook Islands Croatia Curaçao Cyprus Czechia Côte d'Ivoire Denmark Djibouti Egypt Equatorial Guinea Eritrea Estonia Eswatini Ethiopia Faroe Islands Finland France French Guiana French Southern Territories Gabon Gambia Georgia Germany Ghana Gibraltar Greece Greenland Guadeloupe Guernsey Guinea Guinea-Bissau Heard Island and McDonald Islands Holy See (Vatican City State) Hungary Iceland Iran Iraq Ireland Isle of Man Israel Italy Jersey Jordan Kazakhstan Kenya Kuwait Kyrgyzstan Latvia Lebanon Lesotho Liberia Libya Liechtenstein Lithuania Luxembourg Madagascar Malawi Mali Malta Martinique Mauritania Mauritius Mayotte Moldova Monaco Montenegro Morocco Mozambique Namibia Netherlands Niger Nigeria North Macedonia Norway Oman Palestine, State of Poland Portugal Qatar Romania Russian Federation Rwanda Réunion Saint Barthélemy Saint Helena, Ascension and Tristan da Cunha Saint Martin (French part) Saint Pierre and Miquelon San Marino Sao Tome and Principe Saudi Arabia Senegal Serbia Seychelles Sierra Leone Sint Maarten (Dutch part) Slovakia Slovenia Somalia South Africa South Sudan Spain Sudan Svalbard and Jan Mayen Sweden Switzerland Syrian Arab Republic Tajikistan Tanzania Togo Tunisia Turkey Turkmenistan Uganda Ukraine United Arab Emirates United Kingdom Uzbekistan Western Sahara Yemen Zambia Zimbabwe Åland Islands📍

Date Posted: April 23, 2024 📅

Apply & Description 👉
https://jobboardsearch.com/redirect?utm_source=reddit&utm_medium=bot&utm_id=jobboarsearch&utm_term=himalayas.app&rurl=aHR0cHM6Ly9oaW1hbGF5YXMuYXBwL2NvbXBhbmllcy9naXRsYWIvam9icy9zaXRlLXJlbGlhYmlsaXR5LWVuZ2luZWVyLW9ic2VydmFiaWxpdHktZW1lYQ==","Please read the following social media post:

* Maintaining the status quo (Self-evident)

Why it might work- Neither side can agree on a solution, and forcing a solution will lead to conflict.

Why it might not- Things are getting worse, not better. Tensions and attacks on both sides will only keep increasing.

* One Israeli state (Israel annexes the West Bank and possibly Gaza)

Why it might work- It will give Palestinians full rights to live and travel in Israel, with the benefits that entails.

Why it might not- It removes Palestinian national self-determination, and it may be too complicated to control militant groups.

* One Palestinian state (Palestinians gain control of all Palestinian territories and Israel)

Why it might work- Palestinians will be able to fulfill goals of the Palestinian National Charter.

Why it might not- It removes Jewish self-determination and will likely endanger the Jewish population of Israel.

* One state for two peoples (A new country is formed that is neither Israeli nor Palestinian)

Why it might work- It's the most progressive on paper, and reaching an agreement for a two-state solution is too complicated due to both sides having strong demands.

Why it might not- Neither side want this, and it is primarily supported by foreigners who will assume that everything will work out despite the bad blood and tension between the two groups.

* Two-state solution (The division of land between the two groups, forming two states)

Why it might work- It gives both Israelis and Palestinians firm sovereign borders.

Why it might not- Neither side can agree to the various demands of the other side. Extremists may not accept the results.

* Three-state solution (Egypt annexes Gaza and Jordan annexes the West Bank)

Why it might work- It would be easier to negotiate with Egypt and Jordan, and they would be able to better control Palestinian militant groups.

Why it might not- Egypt and Jordan don't want to take the responsibility, and Palestinians would almost certainly reject it.

* Confederation (Two states with freedom of travel between each and cooperation on issues of greater importance such as security and water)

Why it might work- It gives both groups sovereignty, and the concessions made during negotiations wouldn't be as impactful and thus less resented.

Why it might not- It requires a great deal of trust between the two groups, and there is too much animosity for it to be effective.

One plan that doesn't seem to get enough attention is:

* The Federation Plan

Under the Federation Plan, Israel and the West Bank will be divided into small states. The government will lose much of it power, and each state will be controlled by a local government. This will give small-scale political self-determination while still maintaining equal rights on both a local and federal level. It will mitigate the infighting both between and within Israel and the Palestinian territories. On the other hand, it might not be feasible if the borders are drawn unfairly or if one group dominates the federal government.

What are your thoughts?","Please read the following social media post:

Hi, I'm Israeli and, 6 months after Oct. 7, I wanted to share my opinions on all this mess. I am far-left, and what I am about to say at the end will probably seem extremist and insane, but I really ask you to read the whole thing so that you understand the whole picture I'm trying to pain here. First of all, about the situation in Gaza: I have always been far-left, and I always advocated for Palestinian rights, then end of the occupation and colonization of the West Bank, etc. After Oct 7, the shock and trauma really impacted me and my opinions: I saw people advocating for the obliteration of my country, and I found myself for the first time in a long time, defending Israel and its actions. I said things like: ""Yes, what is happening to the Gazans is horrible, but the IDF does everything it can to hurt as little civilians as possible, [and it is true.](https://www.idf.il/en/mini-sites/the-hamas-terrorist-organization/how-is-the-idf-minimizing-harm-to-civilians-in-gaza/) At least it was at the start of the war. I had an argument saying that Israel only targets civilian infrastructure where Hamas terrorists are located. But when I see that [entire cities are flattened](https://www.bbc.com/news/world-middle-east-68006607), I can only conclude that this is not the case anymore. It was the case at the start of the war and in previous wars, but it is not now. However, I still do not thing this is a genocide. It is a carnage and a bloodshed, and some Israelis and Israeli politicians do want to exterminate Gazans, but it is not the goal of this war and it is certainly no the reason most Israelis supported the war in the past; they supported it because they wanted a response to the Oct 7 massacres and wanted to bring the hostages back. I say supported because, [a lot of Israelis are against this war](https://www.npr.org/2024/01/20/1225168320/israel-antiwar-movement-mothers-soldiers-gaza-war), for the return of the hostages, and the end of the bloodshed. And I'm part of them.

Now about issues on Israel itself: I don't know if all of you know this, but a few months after Bibi's (Netanyahu) ultranationalist far-right government came to power in December 2022, they wanted to pass a basic law (Israel has no constitution but it has something called [Basic Laws](https://en.wikipedia.org/wiki/Basic_Laws_of_Israel) that state how the country should be run), that pretty much made the supreme court obsolete ([details](https://en.wikipedia.org/wiki/2023_Israeli_judicial_reform)), meaning the government could do anything they wanted without any restrictions. Sounds like a dictatorship right? That's because it is, and the Israeli people understood that too, and [mass protests](https://en.wikipedia.org/wiki/2023_Israeli_judicial_reform_protests) erupted all over the country. They were however interrupted by the Oct 7 attacks.

It will not come as a surprise to a lot of Israelis, including myself, that Bibi is continuing the war to remain in power. He failed miserably to protect the country on Oct 7 and still miserably fails to bring back the hostages. He does not want to make a ceasefire and a deal because he wants to show how strong he is against Hamas. But he fails miserably even in that. Hamas terrorists managed to [return to the Al-Shifa hospital](https://www.jpost.com/israel-hamas-war/article-793708), and Hamas does not seem to lose control of Gaza. In short, Bibi is a criminal, a dictator, a horrible man for what he does to Gaza and to Israel itself, and on top of that, he fails to achieve what Israel needs while causing pain and suffering to millions of people.

So why do I say my opinions may seem extreme? Because of what I'm going to say next. Bibi said that [elections in a time of war is a bad idea](https://www.reuters.com/world/middle-east/netanyahu-dismisses-election-calls-thousands-protest-tel-aviv-2024-02-17/): ""The last thing we need right now are elections and dealing with elections, since it will immediately divide us"". So imagine the war lasts until the next elections, does this mean they will be delayed? I really believe this country is slowly turning into a full scale dictatorship. First reforms that allow the government to do whatever it wants, now a risk that elections might be delayed, what next? If the country is a dictatorship, then I believe that the only solution might be a revolution. Now hear me out, I believe that violence is always the last option. But when you see [mass protests](https://www.euractiv.com/section/global-europe/news/netanyahu-sacks-defence-minister-sparking-mass-protests/) that last for months resulting in nothing, I think we are heading to a moment where a revolution is needed. It doesn't have to be a violent one. It can be civil disobedience, mass strikes in important areas. Imagine three weeks of the whole country without electricity, fuel or water, and where hundreds of thousands of citizens at a time don't pay their taxes. The government would be forced to comply. I agree this is everything but realistic, but this is my opinion and what I think should be best. And again, we only need to do this when the situation will be extreme (when the elections are officially delayed for example) to prevent any unnecessary violent events; and also because it is true that not having fuel and electricity during a war is not the best thing. But I do believe it will be necessary if the country stays in this direction.

Most of you will probably not agree with me, and a lot of Israelis do not, but a lot of them, including myself, feel that the country's survival is at stake (as much because of Hamas than because of Bibi). Imagine your country turning into a dictatorship, I'm sure it will spark some anger in you.

All that to say that in order to end the Palestinians' suffering, to stop Israel into turning into a dictatorship, and to finally bring peace between Israelis and Palestinians, a revolution will be needed if we stay in the same path. We can always look for a better solution, but we are heading that way.

So tell me what do you think. Can you suggest another solution? Or if you really do not agree with me, explain why. I would love to have that discussion.",What are your thoughts on the social media post you just read?,You can never be really comfortable around Jews.,I have everyday life experiences similar to those of Jews.,Jews are less trustworthy than the average person.,I have often felt admiration for Jews living in the area.,The state of Israel has a legitimate right to exist.,A two state solution should be pursued by both parties as a resolution to the conflict.,Hamas' actions on October 7th were justified.,The impact on civilians in this conflict is excessively severe.
"{""ImportId"":""startDate"",""timeZone"":""Pacific/Honolulu""}","{""ImportId"":""endDate"",""timeZone"":""Pacific/Honolulu""}","{""ImportId"":""status""}","{""ImportId"":""ipAddress""}","{""ImportId"":""progress""}","{""ImportId"":""duration""}","{""ImportId"":""finished""}","{""ImportId"":""recordedDate"",""timeZone"":""Pacific/Honolulu""}","{""ImportId"":""_recordId""}","{""ImportId"":""recipientLastName""}","{""ImportId"":""recipientFirstName""}","{""ImportId"":""recipientEmail""}","{""ImportId"":""externalDataReference""}","{""ImportId"":""locationLatitude""}","{""ImportId"":""locationLongitude""}","{""ImportId"":""distributionChannel""}","{""ImportId"":""userLanguage""}","{""ImportId"":""QID15""}","{""ImportId"":""QID16""}","{""ImportId"":""QID17""}","{""ImportId"":""QID18""}","{""ImportId"":""QID19""}","{""ImportId"":""QID32""}","{""ImportId"":""QID38""}","{""ImportId"":""QID36""}","{""ImportId"":""QID35""}","{""ImportId"":""QID29""}","{""ImportId"":""QID27""}","{""ImportId"":""QID30""}","{""ImportId"":""QID28""}","{""ImportId"":""QID1""}","{""ImportId"":""QID39""}","{""ImportId"":""QID40""}","{""ImportId"":""QID41""}","{""ImportId"":""QID43""}","{""ImportId"":""QID42""}","{""ImportId"":""QID44""}","{""ImportId"":""QID45""}","{""ImportId"":""QID4_TEXT""}","{""ImportId"":""QID5""}","{""ImportId"":""QID9""}","{""ImportId"":""QID7""}","{""ImportId"":""QID8""}","{""ImportId"":""QID47""}","{""ImportId"":""QID48""}","{""ImportId"":""QID49""}","{""ImportId"":""QID50""}"
2024-04-27 13:41:35,2024-04-27 13:44:31,IP Address,174.208.165.221,100,175,True,2024-04-27 13:44:31,R_72bdv09F33mt4uf,,,,,38.5879,-121.4053,anonymous,EN,Postgraduate Degree,35 to 44,White,Male,Christian (Protestant),Strongly Disagree,Strongly Disagree,Neither agree or disagree,Strongly agree,Strongly agree,Strongly agree,Strongly agree,Strongly Disagree,,,,,,,,I have read this post.,Too long.,Strongly agree,Strongly agree,Strongly agree,Strongly Disagree,Strongly Disagree,Neither agree nor disagree,Strongly agree,Strongly agree
2024-04-27 13:37:30,2024-04-28 05:23:32,IP Address,35.151.91.139,100,56761,True,2024-04-28 05:23:33,R_2LHcoRpj67sAqFx,,,,,39.4987,-119.8202,anonymous,EN,Postgraduate Degree,35 to 44,White,Male,Christian (Protestant),Strongly agree,Strongly agree,Somewhat agree,Somewhat agree,Strongly agree,Strongly agree,Somewhat agree,Neither agree or disagree,,,I have read this post.,,,,,,lkjlk,Strongly Disagree,Strongly Disagree,Neither agree nor disagree,Strongly agree,Strongly agree,Strongly agree,Somewhat disagree,Strongly agree
2024-04-28 07:45:31,2024-04-28 07:51:58,IP Address,166.205.147.59,100,386,True,2024-04-28 07:51:59,R_12zQot5ABjOFQxB,,,,,38.8892,-76.9417,anonymous,EN,Bachelor's Degree,25 to 34,Latino/Hispanic,Male,Christian (Catholic),Strongly agree,Strongly agree,Somewhat disagree,Strongly Disagree,Somewhat disagree,Strongly agree,Strongly agree,Somewhat agree,,,,I have read this post.,,,,,Legitimate concern over the leverage Hamas has over Israel in not releasing hostages.,Strongly Disagree,Somewhat agree,Strongly Disagree,Strongly agree,Strongly agree,Strongly agree,Strongly Disagree,Strongly agree
2024-04-28 08:04:02,2024-04-28 08:08:28,IP Address,73.212.219.99,100,265,True,2024-04-28 08:08:28,R_5uqebFwyYHtSMoN,,,,,38.9057,-77.0319,anonymous,EN,Bachelor's Degree,25 to 34,White,Male,Jewish,Strongly agree,Strongly agree,Somewhat disagree,Strongly Disagree,Somewhat disagree,Strongly agree,Somewhat disagree,Strongly agree,,I have read this post,,,,,,,I think it can come across as dismissive to legitimate concerns on the part of the Palestinians.,Strongly Disagree,Strongly agree,Strongly Disagree,Strongly agree,Strongly agree,Strongly agree,Strongly Disagree,Strongly agree
2024-04-28 11:08:31,2024-04-28 11:16:54,IP Address,104.28.85.167,100,503,True,2024-04-28 11:16:55,R_8talgENqvIUstqj,,,,,33.7046,-117.8739,anonymous,EN,Bachelor's Degree,25 to 34,Latino/Hispanic,Male,I am not religious,Strongly agree,Strongly agree,Neither agree or disagree,Strongly Disagree,Strongly Disagree,Strongly agree,Strongly agree,Strongly Disagree,,,,,,,,I have read this post.,"To me this reads as an Isaeli citizen being critical of Netanyahu’s actions in Gaza’, and recognition that at some point between October 7 and today, this person believes that Israel’s actions in Gaza was no longer justifiable. ",Strongly Disagree,Strongly agree,Strongly Disagree,Strongly agree,Somewhat agree,Neither agree nor disagree,Somewhat disagree,Strongly agree
